{
  "model_version": "0.1.0",
  "model_family": "inc15c6-hhs-oig-source-office-groups",
  "department_canonical_id": "ORG-FED-EXE-DEP-HHS",
  "hhs_prior_oig_source_reference": "INC15C3-HHS-LINK-OIG",
  "hhs_prior_oig_legacy_reference": "ARCH04B-HHS-OIG",
  "source_scope": "OIG_internal_publisher_office_headings_and_separate_2025_pdf_role_columns_not_full_HHS_directory",
  "source_html_original_path": "evidence/hhs-oig-2025/originals/hhs_oig_chart/sha256/97fd0513471e013ee8de2534f81184621c7babb7bf2f1d3181f935df275300a6.html",
  "source_html_sha256": "97fd0513471e013ee8de2534f81184621c7babb7bf2f1d3181f935df275300a6",
  "source_html_git_blob_sha1": "5e4281689da34a32add7adc6f522f276bb11fef7",
  "source_html_edition": "retrieval_observation_unqualified_as_of_date",
  "source_html_acquired_in_run": 39668188500,
  "source_pdf_original_path": "evidence/hhs-oig-2025/originals/hhs_oig_2025_pdf/sha256/068fa03980a4add3be412750ce63b0cc435c3d77f54a1153347b19e1200dc3ea.pdf",
  "source_pdf_sha256": "068fa03980a4add3be412750ce63b0cc435c3d77f54a1153347b19e1200dc3ea",
  "source_pdf_git_blob_sha1": "56504a9092deb5d7b44c8c3e6261e11d5a7e8fd8",
  "source_pdf_as_of_date": "2025-12-23",
  "source_pdf_physical_page": 1,
  "publisher_html_office_group_count": 6,
  "pdf_chief_role_column_count": 6,
  "source_roles_are_distinct_from_organizational_offices": true,
  "same_effective_date_as_html_unverified": true,
  "independent_hhs_legal_office_roster_denominator": null,
  "current_hhs_first_level_denominator": null,
  "oversight_reporting_authority_certified": false,
  "signed_delegation_certified": false,
  "legal_identity_certified_count": 0,
  "independent_human_review_complete": false,
  "source_only_research": true,
  "items": [
    {
      "id": "INC15C6-OIG-OFFICE-IO",
      "source_html_office_heading": "Immediate Office of Inspector General",
      "source_html_h2_anchor_id": "immediate-office-of-inspector-general",
      "source_html_display_order": 1,
      "source_pdf_related_column_heading": "Deputy Inspector General for Immediate Office, Chief of Staff",
      "source_pdf_column_order": 1,
      "office_reference_parent_source_id": "INC15C3-HHS-LINK-OIG",
      "canonical_oig_suborganization_id": null,
      "source_html_publisher_office_group": true,
      "source_pdf_heading_classification": "leadership_position_column_not_independent_institution",
      "candidate_same_office_family_not_independently_qualified": true,
      "official_org_chart_implies_signed_control": false,
      "oversight_independence_legal_review_complete": false,
      "current_staffing_verified": false,
      "operational_command_or_fiscal_delegation_verified": false
    },
    {
      "id": "INC15C6-OIG-OFFICE-OAS",
      "source_html_office_heading": "Office of Audit Services",
      "source_html_h2_anchor_id": "office-of-audit-services",
      "source_html_display_order": 2,
      "source_pdf_related_column_heading": "Deputy Inspector General for Audit Services",
      "source_pdf_column_order": 2,
      "office_reference_parent_source_id": "INC15C3-HHS-LINK-OIG",
      "canonical_oig_suborganization_id": null,
      "source_html_publisher_office_group": true,
      "source_pdf_heading_classification": "leadership_position_column_not_independent_institution",
      "candidate_same_office_family_not_independently_qualified": true,
      "official_org_chart_implies_signed_control": false,
      "oversight_independence_legal_review_complete": false,
      "current_staffing_verified": false,
      "operational_command_or_fiscal_delegation_verified": false
    },
    {
      "id": "INC15C6-OIG-OFFICE-OEI",
      "source_html_office_heading": "Office of Evaluation and Inspections",
      "source_html_h2_anchor_id": "office-of-evaluation-and-inspections",
      "source_html_display_order": 3,
      "source_pdf_related_column_heading": "Deputy Inspector General for Evaluation and Inspections",
      "source_pdf_column_order": 4,
      "office_reference_parent_source_id": "INC15C3-HHS-LINK-OIG",
      "canonical_oig_suborganization_id": null,
      "source_html_publisher_office_group": true,
      "source_pdf_heading_classification": "leadership_position_column_not_independent_institution",
      "candidate_same_office_family_not_independently_qualified": true,
      "official_org_chart_implies_signed_control": false,
      "oversight_independence_legal_review_complete": false,
      "current_staffing_verified": false,
      "operational_command_or_fiscal_delegation_verified": false
    },
    {
      "id": "INC15C6-OIG-OFFICE-OMP",
      "source_html_office_heading": "Office of Management and Policy",
      "source_html_h2_anchor_id": "office-of-management-and-policy",
      "source_html_display_order": 4,
      "source_pdf_related_column_heading": "Deputy Inspector General for Management and Policy",
      "source_pdf_column_order": 6,
      "office_reference_parent_source_id": "INC15C3-HHS-LINK-OIG",
      "canonical_oig_suborganization_id": null,
      "source_html_publisher_office_group": true,
      "source_pdf_heading_classification": "leadership_position_column_not_independent_institution",
      "candidate_same_office_family_not_independently_qualified": true,
      "official_org_chart_implies_signed_control": false,
      "oversight_independence_legal_review_complete": false,
      "current_staffing_verified": false,
      "operational_command_or_fiscal_delegation_verified": false
    },
    {
      "id": "INC15C6-OIG-OFFICE-OI",
      "source_html_office_heading": "Office of Investigations",
      "source_html_h2_anchor_id": "office-of-investigations",
      "source_html_display_order": 5,
      "source_pdf_related_column_heading": "Deputy Inspector General for Investigations",
      "source_pdf_column_order": 5,
      "office_reference_parent_source_id": "INC15C3-HHS-LINK-OIG",
      "canonical_oig_suborganization_id": null,
      "source_html_publisher_office_group": true,
      "source_pdf_heading_classification": "leadership_position_column_not_independent_institution",
      "candidate_same_office_family_not_independently_qualified": true,
      "official_org_chart_implies_signed_control": false,
      "oversight_independence_legal_review_complete": false,
      "current_staffing_verified": false,
      "operational_command_or_fiscal_delegation_verified": false
    },
    {
      "id": "INC15C6-OIG-OFFICE-OCIG",
      "source_html_office_heading": "Office of Counsel to the Inspector General",
      "source_html_h2_anchor_id": "office-of-counsel-to-the-inspector-general",
      "source_html_display_order": 6,
      "source_pdf_related_column_heading": "Chief Counsel to the Inspector General",
      "source_pdf_column_order": 3,
      "office_reference_parent_source_id": "INC15C3-HHS-LINK-OIG",
      "canonical_oig_suborganization_id": null,
      "source_html_publisher_office_group": true,
      "source_pdf_heading_classification": "leadership_position_column_not_independent_institution",
      "candidate_same_office_family_not_independently_qualified": true,
      "official_org_chart_implies_signed_control": false,
      "oversight_independence_legal_review_complete": false,
      "current_staffing_verified": false,
      "operational_command_or_fiscal_delegation_verified": false
    }
  ]
}
